id,sentence,labels
2984,insertion operator for combining subtrees as in tree adjoining grammar s ( TAG ) ( Joshi 1985 ) or tree insertion grammars ( TIG ) ( Schabes and Waters 1995 ),O O O O O O O B-long I-long I-long O O B-short O O O O O O B-long I-long I-long O B-short O O O O O O O
2985,predicate only f score M METEOR WN WordNet H_FL human fluency score H_AC human accuracy score H_AVE human average score 9,O O O O O B-long B-short B-long B-short B-long I-long O B-short B-long I-long O B-short B-long I-long O O
2986,2 2 Singular Value Decomposition Given any matrix S its singular value decomposition ( SVD ) is S U?V T The matrix Sk,O O O O O O O O O O B-long I-long I-long O B-short O O O B-short O O O O
2987,"features O-SEM ( ordinary semantics ) and I,'-SKEL ( F-skeleton ) of the type of a semantic ob ject tile set valued IS-CSTR ( IS constraints ) and the binary MAX-F ( for potential maximal focus )",O B-short O B-long I-long O O B-short O B-long O O O O O O O O O O O O B-short O B-long I-long O O O O B-short O O O O O O
2988,LEAD ( lead based ) n sentences are chosen from the beginning of the text,B-short O B-long O O O O O O O O O O O O
2989,eigenvalues are not zero then I minimizes the multiway normalized cut ( MNCut ) MNCut ( I ) K,O O O O O O O O B-long I-long I-long O B-short O B-short O O O O
2990,From the set of erroneous instances True Positive ( TP ) ML class 6 student class False Negative ( FN ) ML class student class,O O O O O O B-long I-long O B-short O B-short O O O O B-long I-long O B-short O B-short O O O
2991,Relative standard deviation of three intervals left edge to anchor ( LE-A ) center to anchor ( CC-A ) right edge to anchor ( RE-A ) calculated across productions of word sets by one,O O O O O O B-long I-long I-long I-long O B-short O B-long I-long I-long O B-short O B-long I-long I-long I-long O B-short O O O O O O O O O
2992,larger segments Speech Systems Incorporated ( SSI ) has been using a version of this two stage cascade of the MMI encoders in the,O O B-long I-long I-long O B-short O O O O O O O O O O O O O B-short O O O
2993,to cover terms frequently used by students such as acronyms E.L.C ( the English Language Center ) R.O.C. ( Republic of China ) and so on Other,O O O O O O O O O O B-short O O B-long I-long I-long O B-short O B-long I-long I-long O O O O O
2994,In order to make the notion of focusing more precise I will use the notion of Reference Time ( RT ) adopted from Reichen bach 1947 but reinterpreted pragmatically RT is to be,O O O O O O O O O O O O O O O O B-long I-long O B-short O O O O O O O O O B-short O O O
2995,However a method based on singular value decomposition ( SVD ) provides an efficient and exact solution to this prob,O O O O O B-long I-long I-long O B-short O O O O O O O O O O
2996,source yes better Table 8 A comparison of syntactic SMT methods ( part 1 ) FST Finite State Transducer SCFG Synchronous Context-Free Grammar TT Tree Transducer,O O O O O O O O O B-short O O O O O B-short B-long I-long I-long B-short B-long I-long I-long B-short B-long I-long
2997,based method is slightly better The two systems share the same topic relevance score ( REL ) and sentiment score but the sentence ranking method,O O O O O O O O O O O O B-long O O B-short O O O O O O O O O
2998,Minimum Sub-Structure ( MSS ) 87 95 87 88 Context Sensitive MSS ( CMSS ) 89 11 89 01 Chunking Tree ( CT ) 86 17 86 21 Linear Features ( Kl ) 90 79 90 46,B-long I-long O B-short O O O O O O O B-short O B-short O O O O O B-long I-long O B-short O O O O O O O O B-short O O O O O
2999,3 2 Feature Space An essential aspect of our approach below is the word sense disambiguation ( WSD ) of the noun Us,O O O O O O O O O O O O O B-long I-long I-long O B-short O O O O O
3000,1 will refer to pa rs primarily oriented towards the former goal as Practical Parser s ( PP ) and refer to the others as Performance Model Parsers ( PMP ) With these distinctions,O O O O O O O O O O O O O B-long I-long O O B-short O O O O O O O B-long I-long I-long O B-short O O O O
3001,Head Path 80 0 72 8 31 8 22 4 Path 80 0 72 7 31 6 22 0 Table 5 Parsing accuracy ( AS attachment score EM exact match U unlabeled L labeled ) Unlabeled Labeled,O O O O O O O O O O O O O O O O O O O O O O O O B-short B-long I-long B-short B-long I-long O B-long O B-long O O O
3002,2009 Word sense disambiguation A survey ACM Computing Surveys ( CSUR ) 41 ( 2 ) 10,O O O O O O B-short B-long I-long O B-short O O O O O O
3003,guages German French and Italian with German usually serving as the source language ( SL ) French and Italian as the target language ( TL ),O O O O O O O O O O O B-long I-long O B-short O O O O O O B-long I-long O B-short O
3004,1 Grider T Mosley H Snow L and Wilson W Users Manual for the Dynamic Analytical Replanning Tool ( DRAFT ) prepared for BBN by Systems Research and Applications Corporation 9 November 1990,O O O O O O O O O O O O O O B-long I-long I-long I-long O B-short O O O O O O O O O O O O O
3005,tion system then the output is classified into a small number of domain specific classes called Domain Acts ( DAs ) that can indicate directly to the dispatcher the general intended meaning of,O O O O O O O O O O O O O O O O B-long I-long O B-short O O O O O O O O O O O O O
3006,mentation in ( Zhang et al 2006 ) 2 2 OOV Recognition with Accessor Variety Accessor variety ( AV ) ( Feng et al 2004 ) is a simple and effective unsupervised method for extrac,O O O O O O O O O O B-short O O O O B-long I-long O B-short O O O O O O O O O O O O O O O O
3007,word and sentence level QE In this work we describe the Fondazione Bruno Kessler ( FBK ) Universitat Polit`ecnica de Val`encia ( UPV ) and Uni,O O O O B-short O O O O O O B-long I-long I-long O B-short O B-long I-long I-long I-long O B-short O O O
3008,ence Semantic Textual Similarity ( STS ) is the task of judging the similarity of two sentences on a scale,O B-long I-long I-long O B-short O O O O O O O O O O O O O O
3009,Specifically we achieve a roughly 10 improvement in precision on text from the information technology ( IT ) business press via post hoc rule based error reduction,O O O O O O O O O O O O O B-long I-long O B-short O O O O O O O O O O
3010,1 Introduction Referring expressions ( REs ) are expressions intended by speakers to identify entities to hearers,O O B-long I-long O B-short O O O O O O O O O O O
3011,cause de la limite des outils informatiques li s son traitement automatique ce qui rend difcile son adh sion ses cons urs dans le domaine des nouvelles technologies de l'information et de la communication ( NTIC ) Par cons quent un ensemble de recherches scientifques et linguistiques sont lanc es pour rem dier,O O O O O O O O O O O O O O O O O O O O O O O O O O B-long I-long I-long I-long I-long I-long I-long I-long O B-short O O O O O O O O O O O O O O O O O
3012,Clark 2010 Sun 2011b Li 2011 ) are usually trained on human annotated corpora such as the Penn Chinese Treebank ( CTB ) ( Xue et al 2005 ) and perform quite well on corresponding test sets,O O O O O O O O O O O O O O O O O O B-long I-long O B-short O O O O O O O O O O O O O O O
3013,Advanced Research and Development Activity ( ARDA ) s Advanced Question Answering for Intelligence ( AQUAINT ) Program a DOI grant under the Reflex,B-long I-long I-long I-long I-long O B-short O O B-long I-long I-long I-long I-long O B-short O O O B-short O O O O
3014,In Proc 6th Canadian Conf on AI ( CSCSI-86 ) pp 78 83,O O O B-long I-long I-long I-long O B-short O B-short O O
3015,Four training and testing corpora were used in the first bakeoff ( Sproat and Emerson 2003 ) including the Academia Sinica Corpus ( AS ) the Penn Chinese Treebank Corpus ( CTB ) the Hong Kong City Uni,O O O O O O O O O O O O O O O O O O O B-long I-long I-long O B-short O O O B-long I-long O O B-short O O O O O O
3016,context Chinese Contex t ( CC ),O B-long I-long O O B-short O
3017,1 Introduction Creating the annotated corpus needed for training a NER ( named entity recognition ) model is costly,O O O O O O O O O O B-short O B-long I-long I-long O O O O
3018,We propose a new algorithm collective iterative classification ( CIC ) to perform approximate inference to find the maximum a posteriori,O O O O O B-long I-long I-long O B-short O O O O O O O O O O O
3019,We suppose that the possessor of a noun phrase is the subject or the noun phrase s nearest opic that has a semantic mark er HUM ( human ) or a seman tic marker AN I ( animal ),O O O O O O O O O O O O O O O O O O O O O O O O O B-short O B-long O O O O O O B-short O O O O
3020,As a starting point the classes for complements and features developed by the New York Univer sity Linguistic String Project ( LSP ) ( Fitzpatrick 1981 ) were selected sin ( x the coverage is very,O O O O O O O O O O O O O O O O O B-long I-long I-long O B-short O O O O O O O O O O O O O O
3021,idea was an early version of branching entropy one of the experts in VE and they developed an algorithm called Phoneme to Morpheme ( PtM ) around it,O O O O O O O O O O O O O B-short O O O O O O B-long I-long I-long O B-short O O O
3022,system components goes through GDM thereby insu lating parts from each other and providing a uniform API ( applications programmer interface ) for manip ulating the data produced by the system,O O O O B-short O O O O O O O O O O O B-short O B-long I-long I-long O O O O O O O O O O
3023,SUBS substantif compl ment VT verbe conjugu6 PROC pronom compl ment SUSU substantif sujet,B-short B-long O O B-short B-long O B-short B-long I-long O B-short B-long I-long
3024,This I will claim to be in contrast with the ability of temporal subordinate clauses and noun phrases ( NPs ) to direct the listener to any position in the evolving structure ),O O O O O O O O O O O O O O O O B-long I-long O B-short O O O O O O O O O O O O O
3025,formation of globally dispersed virtual communities one of which is the very active and growing movement of Open Source Software ( OSS ) development,O O O O O O O O O O O O O O O O O B-long I-long I-long O B-short O O
3026,chose a method from the second group We use the Hierarchical Agglomerative Clustering ( HAC ) algorithm ( Jain et al 1999 ) for all experiments reported,O O O O O O O O O O B-long I-long I-long O B-short O O O O O O O O O O O O
3027,We first examined three randomly selected portions of the listing in the American Heritage Word Frequency Book ( AHWFB ) side by side with the corresponding entry lists of the American Heritage School Dic,O O O O O O O O O O O O B-long I-long I-long I-long I-long O B-short O O O O O O O O O O O O O O O
3028,framework This algorithm uses grammars in the Chomsky Normal Form ( CNF ) so we employed the open source Natural Language Toolkit2,O O O O O O O B-long I-long I-long O B-short O O O O O O O O O O
3029,5 1 Alternative Models To test LUX?s representations we built a brute force histogram model ( HM ) that discretizes HSV space and tracks frequency distributions of labels directly,O O O O O O B-short O O O O O O B-long I-long O B-short O O O B-short O O O O O O O O
3030,229 Proceedings of the Workshop on Discourse in Machine Translation ( DiscoMT ) pages 19 26 Sofia Bulgaria August 9 2013,O O O O O O B-long I-long I-long I-long O B-short O O O O O O O O O
3031,This data may be presented in various forms e g as dictionaries transition networks for lexical analysis augmented transition networks ( ATN ) for syntactic analysis semantic networks re la t ions end so on,O O O O O O O O O O O O O O O O O B-long I-long I-long O B-short O O O O O O O O O O O O O
3032,For each model sentence MSij the model builder selects the Required Lexicon ( RLijk ) a set of the most essential lexical entities required to appear in a,O O O O B-short O O O O O B-long I-long O B-short O O O O O O O O O O O O O O
3033,ing to its current beliefs concerning the state of the dialogue Reinforcement Learning ( RL ) has been more and more used for the optimisa,O O O O O O O O O O O B-long I-long O B-short O O O O O O O O O O
3034,transitions depending on whether the backward looking center of Ui 1 is maintained or not in Ui and on whether CB ( Ui ) is also the most highly ranked entity ( CP ) of Ui Center Continuation ( CON ) CB ( Ui ) CB ( Ui 1 ) and CB ( Ui ) is the most highly ranked CF ( CP ) of Ui ( i e CP ( Ui ) CB ( Ui ) ),O O O O O O O O O B-short O O O O O O B-short O O O B-short O O O O O O O O O O O B-short O O O O B-long O B-short O B-short O B-long O O O O O O O O O O O O O O O O B-short O B-short O O O O O O B-short O O O B-short O O O O
3035,After grammatical ambiguities are removed by the stochastic parser the phrase is divided into noun phrase s ( NP ) and verb phrase s ( VP ) giving,O O O O O O O O O O O O O O B-long I-long O O B-short O O B-long I-long O O B-short O O
3036,that these heuristics have much effect not only in the inductive inference ( regular SVM ) but also in transductive inference ( TSVM ) especially when the untagged data is large,O O O O O O O O O O O O O O B-short O O O O B-long I-long O B-short O O O O O O O O
3037,( PM ) tree matching without the auxiliary pat terns ( TM ) and tree matching with the auxiliary patterns,O O O O O O O O O B-long O B-short O O O O O O O O
3038,Figure 1 Reference answer representation revisions Typical facets as in ( 1a ) are derived directly from a dependency parse in this case retaining its dependency type label NMod ( noun modifier ) Other facets such as ( 1b e ) are the result of com bining multiple dependencies VMod ( stick to ) and PMod ( to nail ) in the case of ( 1c ),O O O O O O O O O O O O O O O O O O O O O O O O O O O O B-short O B-long I-long O O O O O O O O O O O O O O O O O B-short O O O O O B-short O O O O O O O O O O O
3039,ellieioncy has been drastically improved for n ) orpho logical analysis by representing large dictionaries with Finite State Automata ( FSA ) and by representhig two level rnles and le ical hlforination with finite state,O O O O O O O O O O O O O O O O B-long I-long I-long O B-short O O O O O O O O O O O O O O
3040,Kanayama et al99 Probabilistic model ( ME HPSG ) EDR ( 192 778 ) 88 55 Haruno et al98 Probabilistic model ( DT Boosting ) EDR ( 50 000 ) 85 03 Fujio et al98 Probabilistic model ( ML ) EDR ( 190 000 ) 86 67 Table 4 Comparison with the related work,O O O O O O B-short B-short O B-short O O O O O O O O O O O O B-short O O B-short O O O O O O O O O O B-long O B-short O B-short O O O O O O O O O O O O O
3041,Table 3 Validation results for metaphor interpretation for English and Russian ( ALL ) or just two ( TWO ) validators In most of,O O O O O O O O O O O O O O O O B-long O B-short O O O O O
3042,The different resources used to build ArSenL The English WordNet ( EWN ) ( Miller et al,O O O O O O O O B-long I-long O B-short O O O O O
3043,The Chinese text is segmented with a segmenter trained on CTB data using conditional random fields ( CRF ),O O O O O O O O O O B-short O O B-long I-long I-long O B-short O
3044,res In Section 2 we present a structural reformulation of Support Vector Machines ( SVMs ) that can take similarities between different genres into ac,O O O O O O O O O O B-long I-long I-long O B-short O O O O O O O O O O
3045,grammatically correct ( readability ) We engaged the services of Amazon Mechanical Turks ( AMT ) to judge the generated sentences based on a discrete,O O O O O O O O O O B-long I-long I-long O B-short O O O O O O O O O O
3046,Schauder 91 ) The grammar is divided into an LD ( linear dominance) and an LP ( linear precedence ) part so that the piecewise construction of syntactic,O O O O O O O O O B-short O B-long I-long O O B-short O B-long I-long O O O O O O O O O
3047,Collaboratively constructed resources like Wiktionary ( WKT ) and OmegaWiki ( OW ) provide a viable option for such cases and seem especially suitable,O O O O O O O O O B-long O B-short O O O O O O O O O O O O
3048,726 Proceedings of the 2014 Conference on Empirical Methods in Natural Language Processing ( EMNLP ) pages 657 669 October 25 29 2014 Doha Qatar,O O O O O O O B-long I-long I-long I-long I-long I-long O B-short O O O O O O O O O O
3049,PP ( VP ( VBP exercise ) ( NP ( JJ strict ) ( NN self discipline ) ) ),B-short O B-short O B-long O O O B-short O O O O O B-short O O O O O
3050,tvu aaiti mzhang i2r a star edu sg Abstract Term Extraction ( TE ) is an important component of many NLP applications,O O O O O O O O O B-long I-long O B-short O O O O O O O B-short O
3051,siderable progress The bakeoff series hosted by the Chinese Information Processing Society ( CIPS ) and ACL SIGHAN shows that an F measure of,O O O O O O O O B-long I-long I-long I-long O B-short O O B-short B-short O O O O O O
3052,To solve the ILP models we used lp solve a highly efficient GNU-licence Mixed Integer Programming ( MIP ) solver11 that implements the Branch and Bound algorithm,O O O B-short O O O B-short O O O O B-short B-long I-long I-long O B-short O O O O O O O O O
3053,slightly higher F measures than the UMass dictionary The error rates ( ERR ) for all three dictionaries were identical,O O O O O O O O O B-long I-long O B-short O O O O O O O
3054,3 1 Evaluation methods We use the Relative Utility ( RU ) method ( Radev et al 2000 ) to compare our various summaries,O O O O O O O B-long I-long O B-short O O O O O O O O O O O O O
3055,belief updating model In Proc American Association for Artificial Intelligence ( AAAI ) Workshop on Statistical and Empirical Approaches,O O O O O O B-long I-long I-long I-long O B-short O O O O O O O
3056,2007 Noh and Pad o 2013 ) 2 2 Entailment Core ( EC ) The Entailment Core performs the actual entail,O O O O O O O O O B-long I-long O B-short O O O O O O O O
3057,mentation model which we train on the Arabic side of the multi dialectal training data which consists of Qatari Arabic Egyptian Arabic ( EGY ) Levantine Arabic ( LEV ) and MSA to English,O O O O O O O O O O O O O O O O O O O O B-long O O B-short O B-long O O B-short O O B-short O O
3058,lexical chaining 4 1 LDA Mode Method ( LDA-MM ) The LDA-MM approach places all word tokens that,O O O O B-long I-long I-long O B-short O O B-short O O O O O O
3059,We extracted bag of word features and trained a Support Vector Machine ( SVM ) classifier ( Burges 1998 ) using the above dataset,O O O O O O O O O B-long I-long I-long O B-short O O O O O O O O O O
3060,work first arose out of a broader family of approaches to pattern classifier design known as Generalized Probabilistic Descent ( GPD ) ( Katagiri et al 1991 ),O O O O O O O O O O O O O O O O B-long I-long I-long O B-short O O O O O O O
3061,ily ( lists truncated ) Score log likelihood score f occurrence frequency of keyterm NN noun VV verb AR article AP article+preposition JJ adjective CC con,O O O O O B-short O O B-long O O B-long O O B-short B-long B-short B-long B-short B-long B-short B-long B-short B-long B-short O
3062,Table 6 shows the number of true positive ( TP ) true negative ( TN ) false positive ( FP ) and false negative ( FN ) of models for the stocks,O O O O O O O B-long O B-short O B-long I-long O B-short O B-long I-long O B-short O O B-long I-long O B-short O O O O O O
3063,adapt the model to character or word level or limit the conversion target to only noun or expand it to other Part of Speech ( POS ) tags a series of experiments has been performed,O O O O O O O O O O O O O O O O O O O O O B-long I-long I-long O B-short O O O O O O O O O
3064,Transcutaneous Oxygen ( TcPO2 ) 9 5 Transcutaneous CO2 ( TcPCO2 ) 6 7,B-long I-long O B-short O O O B-long I-long O B-short O O O
3065,Gimenez and Marquez ( 2008 ) measure overlapping grammatical dependency relationships ( DP ) semantic roles ( SR ) and discourse representations ( DR ),O O O O O O O O O B-long I-long O B-short O B-long I-long O B-short O O B-long I-long O B-short O
3066,1 Introduction Syntax parsing is one of the most fundamental tasks in natural language processing ( NLP ) and has attracted extensive attention during the past,O O O O O O O O O O O O B-long I-long I-long O B-short O O O O O O O O O
3067,While much of the focus in developing a statistical machine translation ( SMT ) system revolves around the translation model ( TM ) most systems do not emphasize the role of the language model ( LM ),O O O O O O O O B-long I-long I-long O B-short O O O O O B-long I-long O B-short O O O O O O O O O O B-long I-long O B-short O
3068,ergistic working of several components speech recognition ( ASR ) spoken language understanding ( SLU ) dialog management ( DM ) language generation ( LG ) and text to speech synthesis,O O O O O B-long I-long O B-short O B-long I-long I-long O B-short O B-long I-long O B-short O B-long I-long O B-short O O O O O O
3069,1 Introduction Feature term formalisms ( FTF ) have proven extremely useful for the declarative representation f linguistic,O O B-long I-long I-long O B-short O O O O O O O O O O O
3070,true positive ( TP ) ( i e a correct match ) and an appropriate NNS triple not found in the gold standard set a false negative ( FN ) ( i e an incorrect nonmatch ) as shown in Table 4,B-long I-long O B-short O O O O O O O O O O O B-short O O O O O O O O O B-long I-long O B-short O O O O O O O O O O O O O
3071,the text Our proposed metric is called Sentiment Annotation Complexity ( SAC ),O O O O O O O B-long I-long I-long O B-short O
3072,2 5 Semantic Textual Similarity Semantic Textual Similarity ( STS ) is the task of judging the similarity of a pair of sentences on,O O O O O B-long I-long I-long O B-short O O O O O O O O O O O O O O
3073,We also produced an upper bound using Naive Bayes multinomial ( NBm ) and Support Vector Machine ( SVM ) 6 classifiers with the NTU Sentiment Dictionary ( Ku et al,O O O O O O O B-long I-long I-long O B-short O O B-long I-long I-long O B-short O O O O O B-short O O O O O O
3074,16 Production rule that expands n s parent 17 Parse tree path from n to the nearest support verb 18 Last part of speech ( POS ) subsumed by n 19 Production rule that expands n s left sibling,O O O O O O O O O O O O O O O O O O O O O B-long I-long I-long O B-short O O O O O O O O O O O O O
3075,This work was partly supported by UK EPSRC project GR N36462 93 Robust Accurate Statistical Parsing ( RASP ),O O O O O O B-short B-short O O O O B-long I-long I-long I-long O B-short O
3076,the expected output formally a weighted finite state automation ( FSA ) where V is the set of nodes andE is the set of edge s,O O O O O O B-long I-long I-long O B-short O O O O O O O O O O O O O B-long O
3077,An effective semi supervised extractor will have good performance over a range of extraction tasks and corpora However many of the learning procedures just cited have been tested on only one or two extraction tasks so their generality is uncertain To remedy this we have tested learners based on both assumptions targeting both a MUC ( Message Understanding Conference ) scenario and several ACE ( Automatic Content Extraction ) event types We identify shortcomings of the prior bootstrapping methods propose a more effective and stable ranking method and consider the effect of different corpora and evaluation metrics,O O O O O O O O O O O O O O O O O O O O O O O O O O O O O O O O O O O O O O O O O O O O O O O O O O O O O O B-short O B-long I-long I-long O O O O B-short O B-long I-long I-long O O O O O O O O O O O O O O O O O O O O O O O O O O O O O
3078,The problem of evaluating machine translation output without reference translations is called quality estimation ( QE ) and has recently been the centre of attention ( Bojar et al,O O O O O O O O O O O O B-long I-long O B-short O O O O O O O O O O O O O
3079,Averaged Reca l l ( AR ) 2 PP NP Averaged Prec is ion ( AP ) 2 ( fl3 1 1 ) PP x PR,B-long I-long I-long I-long O B-short O O B-short B-short B-long I-long I-long I-long O B-short O O O O O O O B-short O B-short
3080,To extract the verb noun combinations that have been used by non native speakers in practice we use the Cambridge Learner Corpus ( CLC ) which is a 52 5 million word corpus of learner En,O O O O O O O O O O O O O O O O O O O B-long I-long I-long O B-short O O O O O O O O O O O O
3081,Query key words and concepts Token and concept Indexing Knowledge Source Adapters ( KSAs ) integrate and deliver content from,O O O O O O O O O B-long I-long I-long O B-short O O O O O O
3082,Definition 1 A lexical conceptual structure ( LCS ) is a modified version of the representation proposed by Jackendoff ( 1983 1990 ) that conforms to the following structural form,O O O B-long I-long I-long O B-short O O O O O O O O O O O O O O O O O O O O O O
3083,computational semantics With the rise of massive and easily accessible digital corpora computation of co occurrence statistics has enabled researchers in NLP to build distributional semantic models ( DSMs ) that have found relevance in many application areas,O O O O O O O O O O O O O O O O O O O O O B-short O O B-long I-long I-long O B-short O O O O O O O O O
3084,139 Computational Linguistics Volume 18 Number 2 ( 18a ) sense of JUMP jumping,O O O O O O O O O O O O B-short B-long
3085,DC-10-30 s number 1 engine a General Electric CF6-50C2 experienced a casing breach when the 2nd stage low pressure turbine ( LPT ) anti rotation nozzle locks failed,B-short O O O O O O O B-short O O O O O O O O B-long I-long I-long O B-short O O O O O O
3086,The set of all homonyms built for a sentence is called its morphological structure ( MorphS ),O O O O O O O O O O O O B-long I-long O B-short O
3087,C H A N G E H A V E CSEXCH FOB BEPGFF IN 1 4 ANTEST CALLEC FOR 23 NASREL ( AACC ) S D 24 RES 3 TOP 1 s,O O O O O O O O O O B-short B-short B-short O O O B-long I-long B-short O O O B-short O B-short O B-short O B-short O O
3088,the problem as a multi label classification task we trained a binary classification model for each code using support vector machine ( SVM ) with ten fold cross validation,O O O O O O O O O O O O O O O O O O B-long I-long I-long O B-short O O O O O O
