id,sentence,labels
999,Acknowledgment This work is supported by the 6th Framework Research Program of the European Union ( EU ) LUNA Project IST contract no 33549 www ist luna eu,O O O O O O O O O O O O O B-long I-long O B-short O B-short O B-short O O O O O O O
1000,2010 The PASCAL Visual Object Classes Challenge 2010 ( VOC2010 ) Results,O O O B-long I-long I-long I-long I-long O B-short O O
1001,This examination can be held by plotting values of recall precision and F measure during each step of merging process Figure 5 shows the fluctuation of positive recal l ( PR ) positive preclsion ( AP ) averaged recall ( AR ) averaged precision and F measure ( FM ),O O O O O O O O O O O O O O O O O O O O O O O O O O B-long I-long O O B-short O O O O O O O O O O O O O O O O O O O
1002,( 6 ) health issue s ( HI ) trend other ( 7 ) personal issue s ( PI ) trend decreasing ( 8 ) lectures attended ( LA ) trend other ( 9 ) revision ( R ) trend decreasing,O O O B-long I-long O O B-short O O O O O O B-long I-long O O B-short O O O O O O B-long I-long O B-short O O O O O O B-long O O O O O
1003,X at Y ( verb phr se noun phrase ) X a m ( corot rand word ) After step ( I ) is finished steps ( II ) ( IV ) are repeated recursively,O O O O O O O O O O O O O O O O O O O O O O O B-long I-long O O B-short O O O O O O O
1004,some freedom in the ordering of major phrasal categories like NPs and adverbial phrases for example in the linear order of subject ( SUB J ) direct object ( DOBJ ) and indirect object ( lOB J) with respect o one another,O O O O O O O O O O B-short O O O O O O O O O O B-long O B-short O B-long I-long O B-short O O B-long I-long O B-short O O O O O
1005,1979 ) Most tools and resources developed for natural language processing ( NLP ) of Arabic are designed for MSA,O O O O O O O O B-long I-long I-long O B-short O O O O O O B-short
1006,means of P ( G ) This guarantees that neither trees of maximum height ( MHT ) nor of maximum degree ( MDT ) i e trees which trivially,O O O O O O O O O O O O B-long I-long O B-short O O O B-long I-long O B-short O O O O O O
1007,Single tokenization of compound verbs and named entities ( NE ) provides significant gains over the baseline PB-SMT,O O O O O O B-long I-long O B-short O O O O O O O B-short
1008,1 Introduction Information Extraction ( IE ) is a natural language processing task in which text documents are ana,O O B-long I-long O B-short O O O O O O O O O O O O O
1009,call this set of features Feat IV Table 3 demonstrates the word error rat e ( WER ) improvement enabled by our binary subsampling,O O O O O O O O O O O B-long I-long I-long O O B-short O O O O O O O
1010,tistical machine translation In Proceedings of the Machine Translation Summit ( MT-Summit ),O O O O O O O B-long I-long I-long O B-short O
1011,Table 5 Sample Hindi complex predicates 5 Corpus and pre processing Basic Travel Expressions Corpus ( BTEC ) containing travel conversations is used for,O O O O O O O O O O O B-long I-long I-long I-long O B-short O O O O O O O
1012,Finally it is clear from Figure 6 that certain relations are particularly difficult for both parsers For example indirect object ( IObj ) dependents are low scoring nodes this is because they are often attached to the correct head but are,O O O O O O O O O O O O O O O O O O B-long I-long O B-short O O O O O O O O O O O O O O O O O O O
1013,we have established direct contact with the south korean delegation through tribal elders Figure 2 Random sample of 5 items from study in Section 4 original Google translation ( GT ) results of targeted paraphrasing translation process ( TP ) and a human reference translation,O O O O O O O O O O O O O O O O O O O O O O O O O O B-long I-long O B-short O O O O O B-long I-long O B-short O O O O O O
1014,2 Changes to the AZ Scheme Argumentative Zoning II ( AZ-II ) is a new annotation scheme which is an elaboration of the orig,O O O O B-short O B-long I-long I-long O B-short O O O O O O O O O O O O O
1015,its title read ARG0 ARG1 Figure 2 A sentence parse tree with two predicative tree structures ( PAST s ) which is equal 1 if the target fi is rooted at node n,O O O B-short B-short O O O O O O O O B-long I-long I-long O B-short O O O O O O O O O O O O O O
1016,We train a source totarget PBMT system ( SYS_ST ) and a target to source PBMT system ( SYS_TS ) on the parallel corpus,O O O O O B-short B-long O B-short O O O O O B-long I-long I-long O B-short O O O O O
1017,Narrative Summarization Journal Traitement automatique des langues ( TAL ) Special issue on Context Automatic Text Summariza,O O O B-long I-long I-long I-long O B-short O O O O O O O O
1018,This article describes the collaborative work on applying the newly proposed ISO standard for dialogue act annotation to the Switchboard Dialogue Act ( SWBD-DA ) Corpus as part of our on going effort to promote,O O O O O O O O O O O B-short O O O O O O O B-long I-long I-long O B-short O O O O O O O O O O O
1019,Note in genera the resultant segments such as Declarative Sentence ( SDEC ) Noun Phras e ( NP ) Inf init ive Phrase ( INF ) and Verb Phrase ( VP ),O O O O O O O O B-long I-long O B-short O B-long I-long O O B-short O B-long I-long I-long O O B-short O O B-long I-long O B-short O
1020,Reject validations for reliably deliberate ( Rel ) and unreliable ( URel ) subsets of the metaphor production data given that the,O O O B-long O O B-short O O B-long O B-short O O O O O O O O O O
1021,In integrating this approach into a dialog system we see that the dialog manager ( DM ) no longer determines surface strings to send to the TTS system as is often the case in current dialog systems,O O O O O O O O O O O O B-long I-long O B-short O O O O O O O O O O B-short O O O O O O O O O O
1022,document is zero Agglomerative Hierarchical Clustering ( AHC ) AHC is a bottom up hierarchical clustering,O O O B-long I-long I-long O B-short O B-short O O O O O O
1023,Since we are going to be concerned with definability we first translate CFGs into CFTs ( Context Free Theories ) The,O O O O O O O O O O O O B-short O B-short O B-long I-long I-long O O
1024,described as operating within the same three stage framework as STRAND Parallel Text Miner ( PTMiner ) ( Chen and Nie 2000 ) exploits already existing Web search engines to locate pages by querying for pages in a given language that contain,O O O O O O O O O O B-short B-long I-long I-long O B-short O O O O O O O O O O O O O O O O O O O O O O O O O O
1025,proaches we also report on supplying them with different reordering rule sets a set that was learned on manually aligned data ( MAN ) and a set learned on the same data but with automatic,O O O O O O O O O O O O O O O O O O B-long O O O B-short O O O O O O O O O O O O
1026,VNMT 32 25 34 50 33 78 36 72 30 92 24 41 32 07 Table 1 BLEU scores on the NIST Chinese English translation task AVG average BLEU scores on test sets We,B-short O O O O O O O O O O O O O O O O B-short O O O B-short O O O O B-short B-long B-short O O O O O
1027,301 3 False Attributes ( FA ) these are situations where a value for an attribute has been spec,O O B-long I-long O B-short O O O O O O O O O O O O O
1028,Performance has been measured with both the question followed by an extension ( Q+E ) as well as the question followed by the target and then,O O O O O O O B-long I-long I-long I-long I-long O B-short O O O O O O O O O O O O
1029,As the noun or adjective occur in the first slot of conjunct verbs ( ConjVs ) construction the search starts from the point of noun or adjec,O O O O O O O O O O O B-long I-long O B-short O O O O O O O O O O O O
1030,Taking into account the above strategies we propose three concrete DS to CS conversions Flat conversion with H auxiliary symbol ( FlatH ),O O O O O O O O O O B-short O B-short O B-long I-long I-long I-long O O O B-short O
1031,Moreover in ( Hahn et al 2008a ) two more models are applied to SLU a Maximum Entropy ( EM ) model and a model coming from the Statistical Machine Translation ( SMT ) commu,O O O O O O O O O O O O O O B-short O O B-long O B-short O O O O O O O O B-long I-long I-long O B-short O O
1032,5 2 1 Query Focused Rewards We have proposed an extension to both reward functions to allow for query focused ( QF ) summarization,O O O O O O O O O O O O O O O O O O B-long I-long O B-short O O
1033,Many different algorithms have been used for this task including some machine learning ( ML ) algorithms such as Na ve Bayesian model decision trees and,O O O O O O O O O O O B-long I-long O B-short O O O O O O O O O O O
1034,tence pairs were selected from the WMT Giga corpus if the perplexity of their French part with respect to a language model ( LM ) trained on French news data was below a given threshold,O O O O O O B-short O O O O O O O O O O O O O B-long I-long O B-short O O O O O O O O O O O
1035,POS Entropy ( PosH ) 0 55 0 02 0 21 0 20 0 18 0 11 0 22 1 00 0 16 0 11 Derivation steps ( Step ) 0 05 0 11 0 38 0 35 0 31 0 16 0 32 0 16 1 00 0 24 Word Length ( WLen ) 0 18 0 29 0 03 0 64 0 72 0 56 0 02 0 11 0 24 1 00 Table 1 Correlations between ( mean centered ) predictors,B-long I-long O B-short O O O O O O O O O O O O O O O O O O O O O O B-long O B-short O O O O O O O O O O O O O O O O O O O O O B-long I-long O B-short O O O O O O O O O O O O O O O O O O O O O O O O O O O O O O
1036,As expected the poor performance observed on the sniper text is mainly due to two reasons the presence of out of vocabulary ( OOV ) words and the incorrect translations of terminological,O O O O O O O O O O O O O O O O O O O B-long I-long I-long O B-short O O O O O O O O
1037,to pour ) means that the entity ( wine ) is localized to exterior locus ( barrel ) and crosses the intermediate locus IME ( LOC ) to be localized to the interior INT ( LOC ) ( the bottle ),O O O O O O O O O O O O O O O O O O O O O O B-long O O B-short O O O O O O O O O O O O O O O
1038,the set of required domains Various classification systems were considered including the Dewey Decimal Classification ( DDC ) and Universal Decimal Classification ( UDC ) These schemes however are,O O O O O O O O O O O O B-long I-long I-long O B-short O O B-long I-long I-long O B-short O O O O O
1039,these paths This corresponds to the Viterbi approximation i speech recognition or in other related areas for which hidden Markov models ( HMM's ) are used In all such,O O O O O O O O O O O O O O O O O O B-long I-long I-long O B-short O O O O O O
1040,2 4 Dictionaries of Bahasa Nusantara Indonesian Linguistics Association ( MLI ) Masyarakat Linguistik Indonesia ( MLI ) is a group of institutions organizations and corporation,O O O O O O O O O O B-short O B-long I-long I-long O B-short O O O O O O O O O
1041,The Multi-Perspective Question-Answering ( MPQA ) newswire corpus ( Wilson and Wiebe 2005 ) and the J. D. Power Associates ( JDPA ) automotive review blog post ( Kessler et al 2010 ),O B-long I-long O B-short O O O O O O O O O O O B-long I-long I-long I-long O B-short O O O O O O O O O O O
1042,Each word is considered as an instance Maximum Entropy ( MaxEnt ) is used in this paper,O O O O O O O B-long I-long O B-short O O O O O O
1043,gradient method In The Conference on Advances in Neural Information Processing Systems ( NIPS ),O O O O O O O O B-long I-long I-long I-long O B-short O
1044,When using the classifiers to predict the class of a test example there are four possible outcomes true positive ( TP ) true negative ( TN ) false positive ( FP ) and false nega,O O O O O O O O O O O O O O O O O B-long I-long O B-short O B-long I-long O B-short O B-long I-long O B-short O O O O
1045,nym Instance Hypernym Part Holonym Member Holonym Substance Meronym Entailment Table 1 Similarity features using WordNet ( WN ),O O O O O O O O O O O O O O O B-long O B-short O
1046,former networks for image recognition Bulletin of the International Statistical Institute ( ISI ),O O O O O O O O B-long I-long I-long O B-short O
1047,e mail lynet te goldilocks lcs mit edu ABSTRACT The Air Travel Information System ( ATIS ) domain serves as the common task for DARPA spoken language system re,O O O O O O O O O O B-long I-long I-long I-long O B-short O O O O O O O O B-short O O O O
1048,Finance and economic s ( FAE ) 100 Education ( EDU ) 100 Entertainment ( ENT ) 100 Computer ( COM ) 100,B-long I-long I-long O O B-short O O B-long O B-short O O B-long O B-short O O B-long O B-short O O
1049,ferent corpora Academia Sinica ( AS ) City University of Hong Kong ( HK ) Peking University ( PK ) and Microsoft Research Asia ( MSR ) each of which has its own definition of a word,O O B-long I-long O B-short O O O O B-long I-long O B-short O B-long I-long O B-short O O B-long I-long O O B-short O O O O O O O O O O O
1050,1434 Proceedings of the 3rd Workshop on Hybrid Approaches to Translation ( HyTra ) EACL 2014 pages 82 86 Gothenburg Sweden April 27 2014,O O O O O O O B-long I-long I-long I-long O B-short O B-short O O O O O O O O O
1051,F is a frame name E a frame element name and t and s are sequences of word indices ( t is for the target ( FEE ) ) Using this measure of partial agreement we now,O O O B-long I-long O O O B-long I-long O O O O O O O O O O O O B-long I-long I-long O B-short O O O O O O O O O O
1052,Note that the autoPS heuristic for ranking senses is a more precise estimator than the WordNet most?frequent?sense ( MFS ),O O O B-short O O O O O O O O O O O O B-long O B-short O
1053,of the International Joint Conference on Artificial Intelligence ( IJCAI ),O O B-long I-long I-long I-long I-long I-long O B-short O
1054,We use the two representative corpora mentioned above Penn Chinese Treebank ( CTB ) and PKU?s People?s Daily ( PPD ) in our experiments,O O O O O O O O O B-long I-long O B-short O O B-short B-long I-long O B-short O O O O
1055,a new father node The following simple rule forms a noun phrase ( NP ),O O O O O O O O O O B-long I-long O B-short O
1056,2 Data Kinyarwanda ( KIN ) and Malagasy ( MLG ) are lowresource KIN is morphologically rich and English,O O B-long O B-short O O B-long O B-short O O O B-short O O O O O
1057,only limited discontinuities in each tree Generalized Multitext Grammar ( GMTG ) offers a way to synchronize Mildly Context Sensitive,O O O O O O B-long I-long I-long O B-short O O O O O O O O O
1058,To allow for portability the SABA parser translates its natural language input into an mtermediate s mantic network formalism called SF ( for Sentence Formalism ) presented in details in ( Binot 1984 1985 ),O O O O O B-short O O O O O O O O O O O O O O B-short O O B-long I-long O O O O O O O O O O
1059,ENTITY A appos Figure 2 Dependency tree ( DT ) for the entity blinded sentence,O O O O O B-long I-long O B-short O O O O O O
1060,Classifier models We used a first order linear chain conditional random fields ( CRF ) model as a sequence labeler and a Maximum Entropy ( Maxent ) classifier model as a,O O O O O O O O O B-long I-long I-long O B-short O O O O O O O O B-long I-long O B-short O O O O O
1061,A dialogue act is defined as a pair consisting of a communicative function ( CF ) and a semantic content ( SC ) a CF SC,O O O O O O O O O O O B-long I-long O B-short O O O B-long I-long O B-short O O B-short B-short
1062,The most important forms of discourse of interest o Natural Language Processing ( NLP ) are text and dialogue,O O O O O O O O O B-long I-long I-long O B-short O O O O O
1063,17 classes set in Sun et al ( 2008 ) We used the spectral clustering ( SPEC ) method and settings as in Sun and Korhonen ( 2009 ) but,O O O O O O O O O O O O O B-long I-long O B-short O O O O O O O O O O O O O
1064,MRS constraints have three kinds of literals two kinds of elementary predications ( EPs ) in the first two lines and handle constraints in the third line,B-short O O O O O O O O O B-long I-long O B-short O O O O O O O O O O O O O
1065,media where evidences for both actions and ties are available We begin by necessary description of preliminaries and notations we then present the mutual latent random graphs ( MLRGs ) model upon which both sources of evidence could be exploited simultaneously to capture their mutual influence,O O O O O O O O O O O O O O O O O O O O O O O B-long I-long I-long I-long O B-short O O O O O O O O O O O O O O O O O
1066,Task Defined RAW SCORI ( ( OMM ( OST x number of messages ) ( INFCOST x nnmber o f in fe rences ),O O O O O O B-short O B-long I-long I-long I-long I-long O O O O O O O O O O O
1067,suffixes ( SUF ) such as verb endings nominal cases the nominal feminine ending at etc,B-long O B-short O O O O O O O O O O O O O
1068,tors of a lower dimensional space LSI which is based on Singular Value Decomposition ( SVD ) of matrices has showed to have the ability to ex,O O O O O O B-short O O O O B-long I-long I-long O B-short O O O O O O O O O O O
1069,Perhaps the most well known is that of Merialdo ( 1994 ) who used MLE to train a trigram hidden Markov model ( HMM ) More recent,O O O O O O O O O O O O O O B-short O O O O B-long I-long I-long O B-short O O O
1070,ing instance is created as during training and then presented to the decision tree which returns a confidence value ( CF ) 2 indicating the likelihood that NPi is coreferential to NPj,O O O O O O O O O O O O O O O O O B-long O O B-short O O O O O O B-short O O O B-short
1071,otherwise be very limited annotated data The resource the Online Database of INterlinear text ( ODIN ) makes this data available and provides additional annotation,O O O O O O O O O B-long I-long I-long I-long O O B-short O O O O O O O O O
1072,this corpus is labelled with a set of seven classes beneficial ( BNF ) direction ( DIR ) extent ( EXT ) location ( LOC ) manner ( MNR ) purpose ( PRP ) and temporal ( TMP ),O O O O O O O O O O B-long O B-short O B-long O B-short O B-long O B-short O B-long O B-short O B-long O B-short O B-long O B-short O O B-long O B-short O
1073,sider this sentence is correctly tagged Test data set 1 ( TDS 1 ) contains about 10 of the sentences from the complete emotion,O O O O O O B-long I-long I-long I-long O B-short O O O O O O O O O O O
1074,Syntactic features from SLA research ( SLASYN ) Mean length of clause ( MLC ),O O O B-short O O B-short O B-long I-long I-long I-long O B-short O
1075,factoid ones as well as new elements such as expected polarity type ( EPT ) However opi,O O O O O O O O O B-long I-long I-long O B-short O O O
1076,2 5 Noise Contrastive Estimation Noise contrastive estimation ( NCE ) is another sampling based technique ( Hyv arinen 2010,O O O O O B-long I-long I-long O B-short O O O O O O O O O O
1077,tions for this sentence Figure 5 The LF ( left ) and MRS ( right ) representations for the sentence,O O O O O O O B-short O B-long O O B-short O O O O O O O
1078,cessing information from a structured database a natural language interface to a database ( NLIDB ) ( Kapetanios et al 2010 ),O O O O O O O B-long I-long I-long I-long I-long I-long O B-short O O O O O O O
1079,in cooperation between HU Berlin U Frankfurt and U Jena conducted in the wider context of the Deutsch Diachron Digital ( DDD ) initiative The,O O O B-short O O O O O O O O O O O O O B-long I-long I-long O B-short O O O
1080,These interfaces stand to play a critical role in the ongoing migration of interaction fi oln the desktop to wireless portable computing devices ( PI ) As next generation phones ) that offer limited screen real es,O O O O O O O O O O O O O O O O O O O O B-long I-long I-long O B-short O O O O O O O O O O O O
1081,As noted by Melamed ( 2000 ) the problem of finding the best set of links is the maximum weighted bipartite matching ( MWBM ) problem Given a weighted bipartite graph G ( V1 V2 E ) with,O O O O O O O O O O O O O O O O O O O O O B-long O B-short O O O O O O B-long O O O O O O O
1082,He et al ( 2010 ) measure the similarity between hypothesis and reference translation in terms of the Lexical Functional Grammar ( LFG ) representation,O O O O O O O O O O O O O O O O O O B-long I-long I-long O B-short O O
1083,Tutor s Priming Ratio aggregated by task set ( TS Task Set ) Figure 3 Student s Priming Ratio aggregated by task set ( TS Task Set ) Several significant relationships emerged within the models We discuss a subset of these here,O O O O O O O O O B-short B-long I-long O O O O O O O O O O O O B-short B-long I-long O O O O O O O O O O O O O O O
1084,3 1 Classification Our evaluation was performed using the Maximum Entropy ( MaxEnt ) and Support Vector Machine ( SVM ) classifiers,O O O O O O O O O B-long I-long O B-short O O B-long I-long I-long O B-short O O
1085,Symptom name recognition rate ( RRdet ) recognition error rate ( RERdet ) and recognition F-Measure ( RFMdet ) these metrics are designed,O O B-long I-long O B-short O B-long I-long I-long O B-short O O B-long I-long O B-short O O O O O
1086,Dictionary based methods rely on some dictionary or lexical knowledge base ( LKB ) such as WordNet ( Fellbaum and Miller 1998 ) that con,O O O O O O O O B-long I-long I-long O B-short O O O O O O O O O O O O
1087,The corpora used in our experiments are the Penn Arabic Treebank ( ATB ) ( Maamouri et al2004 ) and the French Treebank ( FTB ) ( Abeill Cl ment and Kinyon,O O O O O O O O B-long I-long I-long O B-short O O O O O O O O B-long I-long O B-short O O O O O O O
1088,between interdependent E steps ( as might arise for an assumption such as ( ( ANB)?C ) ) It is straightforward,O O O O O O O O O O B-long I-long O O O B-short O O O O O
1089,Table 3 Example of retrieved Wikipedia pages from the four different methods tested in this paper Results of diverse merging ( DivM ) appear to cover more topics relevant to the conversation fragment than other methods,O O O O O O O O O O O O O O O O O O B-long I-long O B-short O O O O O O O O O O O O O O
1090,line models Character Segmenter ( CS ) this model simply divides Chinese sentences into sequences,O O B-long I-long O B-short O O O O O O O O O
1091,parser on merged development PTB/PRBK data ( section 24 ) Legend of models ST Split Tags EC enhanced connectivity,O O O O B-short O O O O O O O O B-short B-long I-long B-short B-long I-long
1092,Participants in this study included 39 children with typical development ( TD ) and 21 children with autism spectrum disorder ( ASD ) ASD was di,O O O O O O O O B-long I-long O B-short O O O O O B-long I-long I-long O B-short O B-short O O
1093,5 5 3 Corpus Statistics For training of the question detection module we used the manually annotated set of about 200 000 SWITCHBOARD speech acts14 ( SAs ) 15 for training of the answer detection component we used the eight English CALLHOME dia,O O O O O O O O O O O O O O O O O O O O O O O B-long I-long O B-short O O O O O O O O O O O O O O O O
1094,IV RETROSPECTIVE SSL ( R-SSL ) After,O B-long I-long O B-short O O
1095,October 2001 w out 2000 SPA 30 88 95 68 0 08 Table 2 Results for Identifying Speech Act DATE tags in the October 2001 Communicator Corpus ( Dim Dimension of Date used for output classification ( SPA Speech Act Maj Cl,O O O O O B-short O O O O O O O O O O O O O B-short O O O O O O O O B-short B-long O O O O O O O B-short B-long I-long O B-short
1096,We also used two Korean speech recognizers a speech recognizer made by LG-Elite ( LG Electronics Institute of Technology ) and a Korean commercial speech recog,O O O O O O O O O O O O B-short O B-long I-long I-long O O O O O O O O O
1097,2001 Linguistic Inquiry and Word Count ( LIWC ) LIWC2001,O B-long I-long I-long I-long I-long O B-short O O
1098,ory ( Mann and Thompson 1988 ) or RST represents text by labeled hierarchical structures called Discourse Trees ( DTs ) which can incorporate several layers of other linguistic information e g,O O O O O O O O B-short O O O O O O O B-long I-long O B-short O O O O O O O O O O O O
1099,the Internet ( Colbath 2012 ) Social media poses three major computational challenges dubbed by Gartner the 3Vs of big data volume velocity and variety1 Natural Language Processing ( NLP ) methods in particular face further difficulties arising from the short noisy and strongly contextualised nature of social media In order to address the 3Vs of social media new language technologies have emerged such as the identification and definition of users language varieties and the translation to a different language than the source,O O O O O O O O O O O O O O O O O O O O O O O O O B-long I-long I-long O B-short O O O O O O O O O O O O O O O O O O O O O O O O O O O O O O O O O O O O O O O O O O O O O O O O O O O O O
1100,the feature structures which are associated with each node which prohibit certain compositions are not shown Note also that this is not a lexicalised TAG ( LTAG ) This is somewhat unusual we intend as,O O O O O O O O O O O O O O O O O O O O O O O B-long I-long O B-short O O O O O O O O
1101,would also be possible Personalized PageRank similarity ( PPR ) ( Agirre and Soroa 2009 ) measures the semantic relatedness between two word senses s,O O O O B-long I-long I-long O B-short O O O O O O O O O O O O O O O O
1102,5 Clustering Methods Spectral clustering ( SPEC ) has proved promising in previous verb clustering experiments ( Brew,O O O B-long I-long O B-short O O O O O O O O O O O
1103,TGTM P p pk b TGTM PR pr pkr b r TGTM PL p l ph l b l,B-short O O O O B-short B-short B-long O O O B-short B-short B-long I-long O O O O
1104,S for the count in non speculative ones ) 3 Methods Conditional random fields ( CRF ) model was firstly introduced by Lafferty et al ( 2001 ),O O O O O O O O O O O B-long I-long I-long O B-short O O O O O O O O O O O O
1105,( 5 ) Rank Value i Top Rank ( T-Rank ) The rank of snippet that first contains the candidate,O O O O O O B-long I-long O B-short O O O O O O O O O O
1106,TH DR EG LC 56 51 TH EG LC 56 50 Character Type ( CT ) 51 96 Word Familiarity ( WF ) 51 50,B-short B-short B-short B-short O O B-short B-short B-short O O B-long I-long O B-short O O O B-long I-long O B-short O O O
